source,author,title,description,url,urlToImage,publishedAt,content
"{'id': None, 'name': 'Electrek'}",Fred Lambert,"New study of 1,300 EVs busts battery degradation myths, Kia and Tesla top the list","We are getting some critical new data on battery health from a large-scale study in Sweden, and it’s a massive blow to EV naysayers.



The Swedish used-car marketplace Kvdbil conducted a large-scale test analyzing the “State of Health” (SoH) of over 1,300 us…",http://electrek.co/2025/10/27/new-study-evs-busts-battery-degradation-myths-kia-tesla-top-list/,https://i0.wp.com/electrek.co/wp-content/uploads/sites/3/2024/08/Electric-vehicles-5K-1.jpeg?resize=1200%2C628&quality=82&strip=all&ssl=1,2025-10-27T16:41:24Z,"(Source: Tesla)
We are getting some critical new data on battery health from a large-scale study in Sweden, and its a massive blow to EV naysayers.
The Swedish used-car marketplace Kvdbil conducted… [+2738 chars]"
"{'id': None, 'name': 'BGR'}",staff@bgr.com (José Adorno),Avoid Buying The M5 iPad Pro From Brazil And These 4 Other Countries: Here's Why,"Brazil, Turkey, Sweden, Denmark, and Polland are among the most expensive countries to buy the M5 iPad Pro, with the cost in Brazil reaching $2,295.",https://www.bgr.com/1999291/most-expensive-countries-buy-ipad-pro-m5/,https://www.bgr.com/img/gallery/avoid-brazil-and-these-4-other-countries-when-buying-the-m5-ipad-pro-heres-why/l-intro-1760690016.jpg,2025-10-17T08:49:14Z,"A ""perk"" of Brazil always being so expensive to buy Apple products is that the starting price hasn't changed much from the M1 iPad Pro to the M5 generation. Over the years, Apple has only increased t… [+679 chars]"
"{'id': None, 'name': 'EURACTIV'}",Vasiliki Angouridi,Sweden struggling to balance new COVID-19 vaccine strategy with public finances,Sweden’s COVID-19 vaccine policy sparks debate over age thresholds and economic trade-offs,https://www.euractiv.com/news/sweden-struggling-to-balance-new-covid-19-vaccine-strategy-with-public-finances/,https://www.euractiv.com/content/uploads/sites/2/2025/10/GettyImages-1344723070.jpg,2025-10-15T02:35:43Z,"Sweden has diverged from several European peers in its autumn COVID-19 vaccination strategy, prompting criticism from medical experts and raising questions about the balance between public health and… [+2867 chars]"
"{'id': None, 'name': 'The Local Sweden'}",Paul O'Mahony,How hatred and threats are undermining Swedish democracy,"In this week's podcast: bad-tempered politicians, and why did readers move to Sweden? For Membership+ subscribers: Busch under fire for description of ""so-called Swedish protestors"", and how sexually liberated is Sweden?",https://www.thelocal.se/20251018/how-hatred-and-threats-are-undermining-swedish-democracy,https://assets.thelocal.com/cdn-cgi/rs:fit:1200/quality:75/plain/https://apiwp.thelocal.com/wp-content/uploads/2023/06/watermarks-logo-sweden-in-focus.jpg@webp,2025-10-18T05:42:01Z,"In this week's podcast: bad-tempered politicians, and why did readers move to Sweden? For Membership+ subscribers: Busch under fire for description of ""so-called Swedish protestors"", and how sexually… [+1341 chars]"
"{'id': None, 'name': 'The Local Sweden'}",TT/Becky Waterton,'Pure bribery': Sweden paid Somalia millions to accept deportees,"The Swedish government paid Somalia five million kronor to increase the number of deportees it receives from Sweden, according to Swedish media. The Social Democrats have reported Migration Minister Johan Forssell to the constitutional committee to explain th…",https://www.thelocal.se/20251027/pure-bribery-sweden-paid-somalia-millions-to-accept-deportees,https://assets.thelocal.com/cdn-cgi/rs:fit:1200/quality:75/plain/https://apiwp.thelocal.com/wp-content/uploads/2025/10/watermarks-logo-sdldMsAAUTHKXw.jpg@webp,2025-10-27T15:02:03Z,"The Swedish government paid Somalia five million kronor to increase the number of deportees it receives from Sweden, according to Swedish media. The Social Democrats have reported Migration Minister … [+3346 chars]"
"{'id': None, 'name': 'The Local Sweden'}",Richard Orange,TELL US: What's it like separating or getting divorced in Sweden?,"Sweden has one of the highest divorce rates in the European Union, and divorce is also a relatively simple process. We want to hear from foreigners who have been through a divorce or separation in Sweden, or who are currently doing so, about their experiences",https://www.thelocal.se/20251025/tell-us-whats-it-like-separating-or-getting-divorced-in-sweden,https://assets.thelocal.com/cdn-cgi/rs:fit:1200/quality:75/plain/https://apiwp.thelocal.com/wp-content/uploads/2025/07/watermarks-logo-sdl3F8adJgQV0w.jpg@webp,2025-10-25T06:34:44Z,"Divorce is the last thing on your mind when you get married, but a prenup can also be useful if you have a child from a previous marriage. Photo: Janerik Henriksson/TT
Sweden has one of the highest … [+541 chars]"
"{'id': None, 'name': 'The Local Sweden'}",Richard Orange,Sweden deported foreigner despite order from UN Committee against Torture,"Sweden risks being found in violation of the UN Convention against Torture after it completed the deportation of a software engineer to his home country, where he claims he could be murdered, despite a written letter from the UN Committee Against Torture requ…",https://www.thelocal.se/20251014/sweden-deported-foreigner-despite-order-from-un-committee-against-torture,https://assets.thelocal.com/cdn-cgi/rs:fit:1200/quality:75/plain/https://apiwp.thelocal.com/wp-content/uploads/2025/10/watermarks-logo-sdl4msMtrlYrLw.jpg@webp,2025-10-14T09:03:40Z,"Sweden risks being found in violation of the UN Convention against Torture after it completed the deportation of a software engineer to his home country, where he claims he could be murdered, despite… [+3670 chars]"
"{'id': None, 'name': 'The Local Sweden'}",Richard Orange,Just how good is Sweden football manager Graham Potter's Swedish?,"Sweden's new football manager Graham Potter, from the UK, instantly won the hearts of Swedes when he was appointed on Monday, opening a press conference with a thank you speech delivered in Swedish. The Local asked our in-house Swedish teacher Jenny Crowther …",https://www.thelocal.se/20251022/just-how-good-is-sweden-football-manager-graham-potters-swedish,https://assets.thelocal.com/cdn-cgi/rs:fit:1200/quality:75/plain/https://apiwp.thelocal.com/wp-content/uploads/2025/10/watermarks-logo-potter2.jpg@webp,2025-10-22T09:12:43Z,"Sweden's new football manager Graham Potter, from the UK, instantly won the hearts of Swedes when he was appointed on Monday, opening a press conference with a thank you speech delivered in Swedish. … [+3116 chars]"
"{'id': None, 'name': 'The Local Sweden'}",James Savage,Sweden needs more of the Nooshi and Ebba show,"Interrupting a political debate isn’t good manners, but it is good TV — and good for democracy. Sweden needs more rowdy debates, not fewer, argues James Savage.",https://www.thelocal.se/20251015/sweden-needs-more-of-the-nooshi-and-ebba-show,https://assets.thelocal.com/cdn-cgi/rs:fit:1200/quality:75/plain/https://apiwp.thelocal.com/wp-content/uploads/2025/10/watermarks-logo-Nooshi.jpg@webp,2025-10-15T05:26:38Z,"Interrupting a political debate isnt good manners, but it is good TV and good for democracy. Sweden needs more rowdy debates, not fewer, argues James Savage.
 With one year left until the election, … [+2780 chars]"
"{'id': None, 'name': 'The Local Sweden'}",AFP,Sweden says Zelensky to visit for 'defence export' announcement,"Ukrainian President Volodymyr Zelensky will travel to Sweden on Wednesday where the two countries will make a ""defence export"" announcement, the Swedish government said.",https://www.thelocal.se/20251022/sweden-says-zelensky-to-visit-for-defence-export-announcement,https://assets.thelocal.com/cdn-cgi/rs:fit:1200/quality:75/plain/https://apiwp.thelocal.com/wp-content/uploads/2025/09/watermarks-logo-sdlCEkUdfQDZKk.jpg@webp,2025-10-22T08:56:43Z,"Ukrainian President Volodymyr Zelensky will travel to Sweden on Wednesday where the two countries will make a ""defence export"" announcement, the Swedish government said.
 Zelensky and Swedish Prime … [+742 chars]"
"{'id': None, 'name': 'The Local Sweden'}",Richard Orange,IN PICTURES: Readers capture Sweden’s autumn in all its glory,"From city parks to rural wilderness, these pictures, all taken by The Local's readers, will make you fall in love with Sweden all over again this autumn.",https://www.thelocal.se/20251016/in-pictures-readers-share-their-best-swedish-autumn-snaps-2,https://assets.thelocal.com/cdn-cgi/rs:fit:1200/quality:75/plain/https://apiwp.thelocal.com/wp-content/uploads/2025/10/watermarks-logo-odita-kabir-jonkoping.jpg@webp,2025-10-16T08:14:37Z,"From city parks to rural wilderness, these pictures, all taken by The Local's readers, will make you fall in love with Sweden all over again this autumn.
 We received dozens of fantastic photographs… [+2274 chars]"
"{'id': None, 'name': 'The Local Sweden'}",Richard Orange/TT,Swedish gang leader 'The Greek' arrested in Mexico,"The Swedish gang leader Mikael Tenezos – known as Greken or ""The Greek"" – has been arrested in Mexico and deported to Sweden.",https://www.thelocal.se/20251017/swedish-gang-leader-the-greek-arrested-in-mexico,https://assets.thelocal.com/cdn-cgi/rs:fit:1200/quality:75/plain/https://apiwp.thelocal.com/wp-content/uploads/2025/10/watermarks-logo-arrest.jpg@webp,2025-10-17T10:07:11Z,"The Swedish gang leader Mikael Tenezos known as Greken or ""The Greek"" has been arrested in Mexico and deported to Sweden.
 Tenezos, seen as the leading figure in the Dalennätverket gang based in the… [+2043 chars]"
"{'id': None, 'name': 'The Local Sweden'}",Richard Orange,Who has permanent residency as a result of long-term residence in Sweden?,"A government inquiry's new proposal to revoke the permanent residence permits of over 100,000 foreigners in Sweden is targeted at asylum migrants, but will also affect over a thousand people who got permanent residence through EU Long-Term Residence. Here's w…",https://www.thelocal.se/20251020/who-has-permanent-residency-as-a-result-of-long-term-residence-in-sweden,https://assets.thelocal.com/cdn-cgi/rs:fit:1200/quality:75/plain/https://apiwp.thelocal.com/wp-content/uploads/2025/10/watermarks-logo-residency-card-Sweden-2.jpg@webp,2025-10-20T07:27:36Z,"A government inquiry's new proposal to revoke the permanent residence permits of over 100,000 foreigners in Sweden is targeted at asylum migrants, but will also affect over a thousand people who got … [+1597 chars]"
"{'id': None, 'name': 'The Local Sweden'}",TT/Becky Waterton,Today in Sweden: A roundup of the latest news on Friday,"Suspected arson in Malmö, rates of influensa rising, central Sweden sees wave of gang crime committed by minors and fewer cold days now than in the past. Here's Sweden's news on Friday.",https://www.thelocal.se/20251024/today-in-sweden-a-roundup-of-the-latest-news-on-friday-201,https://assets.thelocal.com/cdn-cgi/rs:fit:1200/quality:75/plain/https://apiwp.thelocal.com/wp-content/uploads/2025/10/watermarks-logo-sdl05lM_KnfSSM.jpg@webp,2025-10-24T06:24:12Z,"Suspected arson in Malmö, rates of influensa rising, central Sweden sees wave of gang crime committed by minors and fewer cold days now than in the past. Here's Sweden's news on Friday.
 Two arreste… [+3437 chars]"
"{'id': None, 'name': 'Thelocal.com'}",Mari Wachelke,'Norwegian office workers are lazy': How do Swedes rate life in Norway?,What’s the difference between living in Sweden and Norway? Is life in one country better than the other? Who better to ask than three unbiased Swedes living in Norway.,https://www.thelocal.com/20251017/norwegian-office-workers-are-lazy-how-do-swedes-rate-life-in-norway,https://assets.thelocal.com/cdn-cgi/rs:fit:1200/quality:75/plain/https://apiwp.thelocal.com/wp-content/uploads/2025/10/watermarks-logo-swedn.norway.jpg@webp,2025-10-17T11:24:44Z,"Whats the difference between living in Sweden and Norway? Is life in one country better than the other? Who better to ask than three unbiased Swedes living in Norway.
 While both Sweden and Norway o… [+5469 chars]"
"{'id': None, 'name': 'The Local Sweden'}",TT/Becky Waterton,Today in Sweden: A roundup of the latest news on Monday,"Liberals will vote no to Sweden Democrat ministers, Swedish krona best-performing G10 currency and man in Skåne may have been accidentally shot by hunters. Here's Sweden's news on Monday.",https://www.thelocal.se/20251027/today-in-sweden-a-roundup-of-the-latest-news-on-monday-216,https://assets.thelocal.com/cdn-cgi/rs:fit:1200/quality:75/plain/https://apiwp.thelocal.com/wp-content/uploads/2025/10/watermarks-logo-sdloBK9Ah3-qrc.jpg@webp,2025-10-27T07:10:01Z,"Liberals will vote no to Sweden Democrat ministers, Swedish krona best-performing G10 currency and man in Skåne may have been accidentally shot by hunters. Here's Sweden's news on Monday.
 Liberals … [+3345 chars]"
"{'id': None, 'name': 'The Local Sweden'}",AFP/The Local,Sweden and Ukraine sign letter of intent to supply Gripen fighters,"Swedish Prime Minister Ulf Kristersson said on Wednesday that Sweden and Ukraine had signed a letter of intent to develop air capabilities, which could see Ukraine buy up to 150 Gripen fighter jets.",https://www.thelocal.se/20251022/sweden-and-ukraine-sign-letter-of-intent-to-supply-gripen-fighters,https://assets.thelocal.com/cdn-cgi/rs:fit:1200/quality:75/plain/https://apiwp.thelocal.com/wp-content/uploads/2025/10/watermarks-logo-sdl9JZ-SvF9pEM.jpg@webp,2025-10-22T14:26:33Z,"Swedish Prime Minister Ulf Kristersson said on Wednesday that Sweden and Ukraine had signed a letter of intent to develop air capabilities, which could see Ukraine buy up to 150 Gripen fighter jets.… [+743 chars]"
"{'id': None, 'name': 'The Local Sweden'}",TT/Becky Waterton,Man jailed in Sweden for biting off opponent's fingertip in football match,A man in his mid-30s has been sentenced to ten months in a Swedish prison after biting his opponent's fingertip off in an argument during a football match.,https://www.thelocal.se/20251024/man-in-sweden-jailed-for-biting-off-opponents-fingertip-in-football-match,https://assets.thelocal.com/cdn-cgi/rs:fit:1200/quality:75/plain/https://apiwp.thelocal.com/wp-content/uploads/2025/10/watermarks-logo-sdlSa06EH5KHZo.jpg@webp,2025-10-24T08:39:13Z,"A man in his mid-30s has been sentenced to ten months in a Swedish prison after biting his opponent's fingertip off in an argument during a football match.
 According to the court decision, reported… [+1402 chars]"
"{'id': None, 'name': 'The Local Sweden'}",Richard Orange,Cradle to grave: The 12 digits that shape every life in Sweden,"The personal number is the backbone of the Swedish social system, the handle the welfare state and tax authorities uses to link data on residents. The Local explains how it follows residents, quite literally from cradle to grave.",https://www.thelocal.se/20251024/cradle-to-grave-the-12-digits-that-shape-every-life-in-sweden,https://assets.thelocal.com/cdn-cgi/rs:fit:1200/quality:75/plain/https://apiwp.thelocal.com/wp-content/uploads/2025/10/watermarks-logo-akuten.jpg@webp,2025-10-24T10:18:43Z,"The personal number is the backbone of the Swedish social system, the handle the welfare state and tax authorities uses to link data on residents. The Local explains how it follows residents, quite l… [+6286 chars]"
"{'id': None, 'name': 'The Local Sweden'}",TT/Becky Waterton,Today in Sweden: A roundup of the latest news on Monday,"Christian Democrats call for burqa ban, one dead in fire in Landskrona, party leaders 'shouty' in immigration debate and clothing sales up. Here's Sweden's news on Monday.",https://www.thelocal.se/20251013/today-in-sweden-a-roundup-of-the-latest-news-on-monday-214,https://assets.thelocal.com/cdn-cgi/rs:fit:1200/quality:75/plain/https://apiwp.thelocal.com/wp-content/uploads/2025/08/watermarks-logo-busch.jpg@webp,2025-10-13T05:57:34Z,"Christian Democrats call for burqa ban, one dead in fire in Landskrona, party leaders 'shouty' in immigration debate and clothing sales up. Here's Sweden's news on Monday.
 Christian Democrat leader… [+3535 chars]"
"{'id': None, 'name': 'The Local Sweden'}",TT/Becky Waterton,Today in Sweden: A roundup of the latest news on Monday,"Rental hikes lower this year than previous years, teens hospitalised after drinking bootleg alcohol and gang leader held on suspicion of 30 crimes. Here's Sweden's news on Monday.",https://www.thelocal.se/20251020/today-in-sweden-a-roundup-of-the-latest-news-on-monday-215,https://assets.thelocal.com/cdn-cgi/rs:fit:1200/quality:75/plain/https://apiwp.thelocal.com/wp-content/uploads/2025/10/watermarks-logo-sdlL_qxhsbfXtM.jpg@webp,2025-10-20T06:18:39Z,"Rental hikes lower this year than previous years, teens hospitalised after drinking bootleg alcohol and gang leader held on suspicion of 30 crimes. Here's Sweden's news on Monday.
 How much could Sw… [+3537 chars]"
"{'id': None, 'name': 'The Local Sweden'}",Richard Orange,TELL US: How true is the sexually liberated Swedish stereotype?,"From the 1950s to the 1970s, Sweden became a poster country for liberated sexuality, especially in the US, and while a lot has changed since then, the stereotype lingers on. We want to hear from our readers about whether they think the sexually liberated ster…",https://www.thelocal.se/20251014/tell-us-how-true-is-the-sexually-liberated-swedish-stereotype,https://assets.thelocal.com/cdn-cgi/rs:fit:1200/quality:75/plain/https://apiwp.thelocal.com/wp-content/uploads/2025/10/watermarks-logo-sdlrKTOxMeMYuM.jpg@webp,2025-10-14T11:06:04Z,"From the 1950s to the 1970s, Sweden became a poster country for liberated sexuality, especially in the US, and while a lot has changed since then, the stereotype lingers on. We want to hear from our … [+1354 chars]"
"{'id': None, 'name': 'The Local Sweden'}",Becky Waterton,'Feels like a fairytale': Swedish town's one-krona plots a year later,"In April last year, the municipality of Götene in western Sweden launched a campaign to sell off unused plots of land for just one krona per square metre in an attempt to attract families to the area. We spoke to Götene's mayor, Johan Månsson, to find out how…",https://www.thelocal.se/20251023/feels-like-a-fairytale-swedish-towns-one-krona-plots-a-year-later,https://assets.thelocal.com/cdn-cgi/rs:fit:1200/quality:75/plain/https://apiwp.thelocal.com/wp-content/uploads/2025/10/watermarks-logo-Untitled-design.jpg@webp,2025-10-23T06:54:29Z,"In April last year, the municipality of Götene in western Sweden launched a campaign to sell off unused plots of land for just one krona per square metre in an attempt to attract families to the area… [+9605 chars]"
"{'id': None, 'name': 'BroBible'}",Cass Anderson,"The Eeriest Marathon On Earth Takes Place 3,674ft Below Ground Inside A Swedish Mine: Would You Run It?","We have seen some uniquely interesting marathons and long distance races over the years here at BroBible. But none really compared to this underground marathon in Sweden where participants take a mine shaft elevator 1,120 meters (3,647 feet) below ground to r…",https://brobible.com/sports/article/worlds-first-underground-marathon-sweden/,https://brobible.com/wp-content/uploads/2025/10/underground-marathon-runner-sweden.jpg,2025-10-27T15:10:35Z,"Worlds Deepest Marathon
We have seen some uniquely interesting marathons and long distance races over the years here at BroBible. But none really compared to this underground marathon in Sweden wher… [+2566 chars]"
"{'id': None, 'name': 'Madshrimps.be'}",Stefan,Heart Electric: Colorful New Team-Based Shooter From Star Wars Battlefront Dev Gets October Playtest,"Modoyo is a new game studio out of Stockholm, Sweden, and its first game is Heart Electric, a fast-paced elimination hero shooter that pits 16 players against one another in teams of four, with the added twist of the “Flux” maglev traversal mechanic that adds…",https://www.madshrimps.be/news/heart-electric-colorful-new-team-based-shooter-from-star-wars-battlefront-dev-gets-october-playtest/,,2025-10-22T10:19:51Z,"Modoyo is a new game studio out of Stockholm, Sweden, and its first game is Heart Electric, a fast-paced elimination hero shooter that pits 16 players against one another in teams of four, with the a… [+505 chars]"
"{'id': None, 'name': 'Israelnationalnews.com'}",Giulio Meotti,"In Islamized Europe, even Jewish films are banned","To quote Malmö’s imam Basem Mahmoud, “whether Swedes like it or not, in ten or fifteen years, Sweden will be ours.” Opinioin.",https://www.israelnationalnews.com/news/416652,https://2.a7.org/files/pictures/000/1043932.jpg,2025-10-22T10:48:00Z,"The cinemas in Malmö refused to host the Jewish Film Festival.
Out of seven cinema chains, not one theater in Swedens third-largest city had the courage to host an innocent Jewish film festival. No … [+1932 chars]"
"{'id': None, 'name': 'Rlsbb.to'}",saamaan1@yahoo.com (Master),To Cook a Bear S01 1080p WEB h264-EDITH,"Note: In Swedish With English Selectable Subtitles or (HERE). Koka björn (To Cook a Bear) is a fantastic tale set in the far north of Sweden in 1852 following Jussi, a runaway Sami boy, and his mentor, the revivalist preacher Laestadius, as they investigate a…",https://post.rlsbb.to/to-cook-a-bear-s01-1080p-web-h264-edith/,,2025-10-15T07:55:46Z,"Note: In Swedish With English Selectable Subtitles or (HERE).
 Koka björn (To Cook a Bear) is a fantastic tale set in the far north of Sweden in 1852 following Jussi, a runaway Sami boy, and his men… [+1331 chars]"
